{
  "$schema": "https://json-schema.org/draft/2020-12/schema",
  "$id": "https://lecture-notes.example/schema/lecture-v2.schema.json",
  "title": "Bilingual lecture notes document",
  "type": "object",
  "additionalProperties": false,
  "required": [
    "schema_version",
    "run_id",
    "lecture",
    "segments",
    "outline",
    "summary_note",
    "glossary"
  ],
  "properties": {
    "schema_version": {
      "const": "2.0"
    },
    "run_id": {
      "type": "string",
      "pattern": "^[0-9a-fA-F]{8}-[0-9a-fA-F]{4}-[1-8][0-9a-fA-F]{3}-[89abAB][0-9a-fA-F]{3}-[0-9a-fA-F]{12}$"
    },
    "lecture": {
      "$ref": "#/$defs/lecture"
    },
    "segments": {
      "type": "array",
      "minItems": 1,
      "items": {
        "$ref": "#/$defs/segment"
      }
    },
    "outline": {
      "type": "object",
      "additionalProperties": false,
      "required": [
        "chapters"
      ],
      "properties": {
        "chapters": {
          "type": "array",
          "minItems": 1,
          "items": {
            "$ref": "#/$defs/chapter"
          }
        }
      }
    },
    "summary_note": {
      "type": "object",
      "additionalProperties": false,
      "required": [
        "overview",
        "key_points"
      ],
      "properties": {
        "overview": {
          "$ref": "#/$defs/nonemptyText"
        },
        "key_points": {
          "type": "array",
          "minItems": 1,
          "items": {
            "$ref": "#/$defs/keyPoint"
          }
        }
      }
    },
    "glossary": {
      "type": "array",
      "items": {
        "$ref": "#/$defs/glossaryTerm"
      }
    }
  },
  "$defs": {
    "nonemptyText": {
      "type": "string",
      "minLength": 1,
      "pattern": "\\S"
    },
    "seconds": {
      "type": "number",
      "minimum": 0
    },
    "index": {
      "type": "integer",
      "minimum": 1
    },
    "lecture": {
      "type": "object",
      "additionalProperties": false,
      "required": [
        "video_id",
        "url",
        "title",
        "duration_sec",
        "caption_language",
        "caption_source",
        "created_at",
        "translation_language"
      ],
      "properties": {
        "video_id": {
          "type": "string",
          "pattern": "^[A-Za-z0-9_-]{11}$"
        },
        "url": {
          "type": "string",
          "pattern": "^https://(www\\.)?youtube\\.com/watch\\?v=[A-Za-z0-9_-]{11}$"
        },
        "title": {
          "$ref": "#/$defs/nonemptyText"
        },
        "duration_sec": {
          "type": "number",
          "exclusiveMinimum": 0,
          "maximum": 10800
        },
        "caption_language": {
          "const": "en"
        },
        "caption_source": {
          "type": "string",
          "enum": [
            "manual",
            "auto"
          ]
        },
        "created_at": {
          "type": "string",
          "pattern": "^\\d{4}-\\d{2}-\\d{2}T\\d{2}:\\d{2}:\\d{2}(\\.\\d+)?(Z|[+-]\\d{2}:\\d{2})$"
        },
        "translation_language": {
          "const": "ko"
        }
      }
    },
    "segment": {
      "type": "object",
      "additionalProperties": false,
      "required": [
        "idx",
        "start_sec",
        "end_sec",
        "text",
        "translation_ko"
      ],
      "properties": {
        "idx": {
          "$ref": "#/$defs/index"
        },
        "start_sec": {
          "$ref": "#/$defs/seconds"
        },
        "end_sec": {
          "$ref": "#/$defs/seconds"
        },
        "text": {
          "$ref": "#/$defs/nonemptyText"
        },
        "translation_ko": {
          "$ref": "#/$defs/nonemptyText"
        }
      }
    },
    "range": {
      "type": "object",
      "required": [
        "title",
        "summary",
        "start_idx",
        "end_idx",
        "start_sec",
        "end_sec"
      ],
      "properties": {
        "title": {
          "$ref": "#/$defs/nonemptyText"
        },
        "summary": {
          "$ref": "#/$defs/nonemptyText"
        },
        "start_idx": {
          "$ref": "#/$defs/index"
        },
        "end_idx": {
          "$ref": "#/$defs/index"
        },
        "start_sec": {
          "$ref": "#/$defs/seconds"
        },
        "end_sec": {
          "$ref": "#/$defs/seconds"
        }
      }
    },
    "child": {
      "type": "object",
      "allOf": [
        {
          "$ref": "#/$defs/range"
        }
      ],
      "unevaluatedProperties": false
    },
    "chapter": {
      "allOf": [
        {
          "$ref": "#/$defs/range"
        }
      ],
      "type": "object",
      "required": [
        "children"
      ],
      "properties": {
        "children": {
          "type": "array",
          "minItems": 1,
          "items": {
            "$ref": "#/$defs/child"
          }
        }
      },
      "unevaluatedProperties": false
    },
    "keyPoint": {
      "type": "object",
      "additionalProperties": false,
      "required": [
        "text",
        "segment_idxs",
        "start_sec"
      ],
      "properties": {
        "text": {
          "$ref": "#/$defs/nonemptyText"
        },
        "segment_idxs": {
          "type": "array",
          "minItems": 1,
          "uniqueItems": true,
          "items": {
            "$ref": "#/$defs/index"
          }
        },
        "start_sec": {
          "$ref": "#/$defs/seconds"
        }
      }
    },
    "glossaryTerm": {
      "type": "object",
      "additionalProperties": false,
      "required": [
        "term",
        "explanation",
        "first_segment_idx",
        "start_sec"
      ],
      "properties": {
        "term": {
          "$ref": "#/$defs/nonemptyText"
        },
        "explanation": {
          "$ref": "#/$defs/nonemptyText"
        },
        "first_segment_idx": {
          "$ref": "#/$defs/index"
        },
        "start_sec": {
          "$ref": "#/$defs/seconds"
        }
      }
    }
  }
}
