{
  "schema_version": "2.0",
  "run_id": "550e8400-e29b-41d4-a716-446655440001",
  "lecture": {
    "video_id": "AbCdEfGhIjK",
    "url": "https://www.youtube.com/watch?v=AbCdEfGhIjK",
    "title": "Introduction to Data Structures",
    "duration_sec": 60,
    "caption_language": "en",
    "caption_source": "manual",
    "created_at": "2026-10-09T00:00:00Z",
    "translation_language": "ko"
  },
  "segments": [
    {
      "idx": 1,
      "start_sec": 0,
      "end_sec": 15,
      "text": "An array stores data in a contiguous region.",
      "translation_ko": "배열은 연속된 데이터를 저장합니다."
    },
    {
      "idx": 2,
      "start_sec": 15,
      "end_sec": 30,
      "text": "We use an index to access an array element.",
      "translation_ko": "인덱스로 배열의 값에 접근합니다."
    },
    {
      "idx": 3,
      "start_sec": 30,
      "end_sec": 45,
      "text": "A linked list connects nodes together.",
      "translation_ko": "연결 리스트는 노드를 이어 붙입니다."
    },
    {
      "idx": 4,
      "start_sec": 45,
      "end_sec": 60,
      "text": "Let us compare the access costs of both structures.",
      "translation_ko": "두 자료 구조의 접근 비용을 비교합니다."
    }
  ],
  "outline": {
    "chapters": [
      {
        "title": "자료 구조의 기초",
        "summary": "배열과 연결 리스트의 특징을 설명합니다.",
        "start_idx": 1,
        "end_idx": 4,
        "start_sec": 0,
        "end_sec": 60,
        "children": [
          {
            "title": "배열",
            "summary": "배열의 저장 방식과 인덱스를 다룹니다.",
            "start_idx": 1,
            "end_idx": 2,
            "start_sec": 0,
            "end_sec": 30
          },
          {
            "title": "연결 리스트",
            "summary": "노드 연결과 접근 비용을 다룹니다.",
            "start_idx": 3,
            "end_idx": 4,
            "start_sec": 30,
            "end_sec": 60
          }
        ]
      }
    ]
  },
  "summary_note": {
    "overview": "배열과 연결 리스트의 저장 방식과 접근 비용을 비교하는 강의입니다.",
    "key_points": [
      {
        "text": "배열은 인덱스로 값에 접근합니다.",
        "segment_idxs": [
          1,
          2
        ],
        "start_sec": 0
      },
      {
        "text": "연결 리스트는 노드를 연결합니다.",
        "segment_idxs": [
          3
        ],
        "start_sec": 30
      }
    ]
  },
  "glossary": [
    {
      "term": "인덱스",
      "explanation": "배열에서 값의 위치를 가리키는 번호입니다.",
      "first_segment_idx": 2,
      "start_sec": 15
    }
  ]
}
